,comment_id,article_id,date,username,from_where,body,level,parent_comment_id,replies_ids
667,hp2p3bv,rjayn9,1639852036.0,lasttimeilooked,r/technews,"ALL THE WORDS 

A tardigrade has been quantum entangled with a superconducting qubit – and lived to tell the tale. It is the first time a multicellular organism has been placed in this strange quantum state and raises questions about what it means for living things to be entangled.
Tardigrades are microscopic animals that can survive extreme temperatures and pressures in a hibernating state called a tun. Rainer Dumke and his colleagues at Nanyang Technological University, Singapore, placed one of these hibernating tardigrades on a superconducting qubit, an element of a quantum computer.
They then lowered the pressure and temperature to almost a perfect vacuum and near absolute zero, reducing any outside influence, or excitations, on the qubit and tardigrade.
“Because all the excitations are frozen out, you can actually describe [the system] in terms of physics, there’s no need to describe it in terms of biology,” says Dumke.
When researchers measured the natural frequency at which the tardigrade and qubit combination vibrates, the result only made sense if the two objects were in a state of quantum entanglement, meaning that their quantum properties were linked.
After they had finished making measurements, the researchers slowly depressurised and warmed up the tardigrade, bringing it out of its tun state and back to life.
The temperature involved, just 0.01°C above absolute zero, is the lowest a tardigrade has ever survived. The fact that the creatures can tolerate such extreme conditions suggests their hardiness is a result of completely shutting off their metabolic processes.
“There was still some discussion that perhaps there is a little bit of metabolism that actually goes on [in the tun tardigrade],” says team member Tomasz Paterek at the University of Gdańsk, Poland. “But this experiment shows – because it’s so cold, and for such a long time – that it’s really ametabolic. There is no chemistry going on in this piece of stuff.”
“The fact you can maintain a quantum state, which has quantum coherence in it and involves the degrees of freedom of a biological system as large as a tardigrade, is very exciting,” says Chiara Marletto at the University of Oxford, who entangled a bacterium with light in 2018.
While the tardigrade was certainly living before and after the entanglement, one point of contention is whether it was alive during the entanglement, and exactly how it was entangled.
“You never know in this kind of experiment what exactly is the part of [the tardigrade] that takes part in the entanglement,’ says Paterek.
The tardigrade was actually the third to undergo the entanglement experiment, as the first two didn’t survive the process as a result of being warmed up too quickly. Despite these technical hurdles, Dumke and his team hope to entangle other forms of life in future.
While technically challenging and not involving live organisms, researchers have entangled photons at room temperature, as well as 3-millimetre-wide diamonds.
But the tardigrade entanglement is an important first step to going further. “It is really in the best tradition of theoretical experimental physics, where you’re being playful, but at the same time, you’re trying to understand and answer deep questions,” says Marletto. “That’s inherently risky, but very rewarding if it works out well. We need more of this stuff.”",0,rjayn9,[]
668,hp2hjeb,rjayn9,1639848773.0,davilller,r/technews,I’m going to be really pissed off it this spawns a 200 meter tall tardigade that gobbles up humans and is resistant to all forms of attack.,0,rjayn9,[]
669,hp2gxzi,rjayn9,1639848511.0,eightcell,r/technews,Ok so I won’t be surprised when a giant tardigrade attacks a major city.,0,rjayn9,[]
670,hp2fvzx,rjayn9,1639848050.0,Darklighter10,r/technews,"Can we stop posting articles behind a paywall without a snippet of the text?  Jesus Christ, it’s common sense.",0,rjayn9,[]
671,hp2ebyy,rjayn9,1639847368.0,matthewjboothe,r/technews,Insert Star Trek: Discovery reference here.,0,rjayn9,[]
672,hp2n0ie,rjayn9,1639851143.0,DocSaysItsDainBramuj,r/technews,"ALL THESE WORLDS ARE YOURS – EXCEPT EUROPA. ATTEMPT NO LANDING THERE. 

-Tardigrades, probably",0,rjayn9,[]
673,hp2vbvh,rjayn9,1639854754.0,willyolio,r/technews,Schrodinger's Tardigrade,0,rjayn9,[]
674,hp5j2op,rjayn9,1639908036.0,lucidlife0,r/technews,Have to subscribe articles should be banned,0,rjayn9,[]
675,hp2amsu,rjayn9,1639845737.0,Temptingfateagain123,r/technews,So there’s a solid chance we sent a living being to another dimension and it returned. …..I’ve seen this movie…. It does not bode well for humanity 😳,0,rjayn9,[]
676,hp2uhbv,rjayn9,1639854382.0,Succulentmeditator,r/technews,I for one welcome our new inter-dimensional water bear overlords.,0,rjayn9,[]
677,hp2p2z7,rjayn9,1639852032.0,jaylynnsmith,r/technews,ELI5: what’s happening here,0,rjayn9,[]
678,hp2mpvq,rjayn9,1639851013.0,Arseypoowank,r/technews,"Look those unkillable motherfuckers seem to survive everything, saying a tardigrade survived something is like saying “oh wow, the sun came up today”",0,rjayn9,[]
679,hp2pozx,rjayn9,1639852296.0,bulletpr00fsoul,r/technews,Time to go back into the Quantum realm with the Ant-Man crew.,0,rjayn9,[]
680,hp2qyr2,rjayn9,1639852854.0,tallerThanYouAre,r/technews,How do we know it’s the same tardigrade?,0,rjayn9,[]
681,hp2v5rb,rjayn9,1639854680.0,Outside-Equivalent38,r/technews,He already survived in the vacuum of my mom,0,rjayn9,[]
682,hp2pwdy,rjayn9,1639852386.0,mas901,r/technews,Water bears are engineered lifeforms created millions of years ago by ancient machines called the reapers to infiltrate all galaxies with instant communications capabilities they are able to warn them of any civilization who is about to reach the singularity. Why else do you think these things can survive boil water and absolute zero. We just clicked the red bottom we’re doomed. The end is nigh!,0,rjayn9,[]
683,hp2ijb0,rjayn9,1639849207.0,Deez_nuts-and-bolts,r/technews,"Of-fucking-course they would, not even the laws of reality could stop these mfs.",0,rjayn9,[]
684,hp3dsww,rjayn9,1639863239.0,wholebeansinmybutt,r/technews,"Tardigrades, the absolute best that life can do.",0,rjayn9,[]
685,hp46qge,rjayn9,1639877547.0,grigsbie,r/technews,"I, for one, welcome our new Tardigrade overlords.",0,rjayn9,[]
686,hp4aq5b,rjayn9,1639879541.0,Kflynn1337,r/technews,Okayyy.. suddenly the Spore drive in Star trek Discovery doesn't sound so stupid after all...,0,rjayn9,[]
687,hp4dds7,rjayn9,1639880851.0,Alclis,r/technews,Black alert!,0,rjayn9,[]
688,hp58q3a,rjayn9,1639899409.0,ShiroHachiRoku,r/technews,Time to see if it can travel the mycelial network.,0,rjayn9,[]
689,hp5hudi,rjayn9,1639906980.0,oracleofnonsense,r/technews,"Survived….lol.  


Fuck you three dimensional, basic bitch, humans…..tardigardes live in five dimensions.",0,rjayn9,[]
690,hp5j8il,rjayn9,1639908175.0,hb1290,r/technews,*The USS Discovery has entered the chat*,0,rjayn9,[]
691,hp2hyii,rjayn9,1639848954.0,No-Error8689,r/technews,WATER BEARS,0,rjayn9,[]
692,hp2cwx4,rjayn9,1639846743.0,studiobeegle,r/technews,Warp bubbles AND teleportation progress in the same year. Sweet!,0,rjayn9,[]
693,hp2lw4e,rjayn9,1639850657.0,CrabPurple7224,r/technews,What is a quantum state?,0,rjayn9,[]
694,hp2me0c,rjayn9,1639850870.0,Onlyindef,r/technews,*doom music intensifies*,0,rjayn9,[]
695,hp2o4oh,rjayn9,1639851622.0,RegulatoryCapturedMe,r/technews,Wasn’t this a Star Trek plot?,0,rjayn9,[]
696,hp2o8bb,rjayn9,1639851665.0,Maximum_Bear8495,r/technews,What the hell does that even mean,0,rjayn9,[]
697,hp2pabf,rjayn9,1639852118.0,CaptianMurica,r/technews,Tardigrade is the grade you get on your test when you do so bad the teacher believes you to be retarded,0,rjayn9,[]
698,hp2ri27,rjayn9,1639853091.0,gofyourselftoo,r/technews,"I found this by googling: 


https://physicsworld.com/a/entangling-a-live-tardigrade-radiation-warning-on-anti-5g-accessories/",0,rjayn9,[]
699,hp2sfi5,rjayn9,1639853494.0,MulderD,r/technews,At what point do we discover that the Tardigrade is actually God.,0,rjayn9,[]
700,hp2tjx3,rjayn9,1639853979.0,mattapperson,r/technews,Clearly no one watched StarTrek Discovery,0,rjayn9,[]
701,hp2tniw,rjayn9,1639854023.0,Rabbidlobo,r/technews,Is this god?,0,rjayn9,[]
702,hp2vuvk,rjayn9,1639854983.0,idelarosa1,r/technews,These little shits can survive anything cant they?,0,rjayn9,[]
703,hp2wegk,rjayn9,1639855226.0,yescaman,r/technews,"*“But this experiment shows – because it’s so cold, and for such a long time – that it’s really ametabolic. There is no chemistry going on in this piece of stuff.”*

So an inert, inanimate object was able to come back to life? That seems pretty astounding",0,rjayn9,[]
704,hp2wm69,rjayn9,1639855320.0,darkdeepths,r/technews,sci-fi where entangled tardigrade tun leaves a high-security quantum computer cloud facility and is later revived to bring down the whole system.,0,rjayn9,[]
705,hp2xlft,rjayn9,1639855753.0,OriginalMrMuchacho,r/technews,"After the inevitable heat-sink death of the universe, there will only remain tardigrade. All things will be tardigrade, forever, into infinity.",0,rjayn9,[]
706,hp2yvd5,rjayn9,1639856330.0,cuntgardener,r/technews,Did no one watch Star Trek Discovery?,0,rjayn9,[]
707,hp3gk11,rjayn9,1639864553.0,lovecreamer,r/technews,"*some other dimension* *News flash! Giant monster destroys multiple cities, killing millions!*",0,rjayn9,[]
708,hp3gy1u,rjayn9,1639864741.0,Correct_Simple8448,r/technews,Startrek discovery is that you?,0,rjayn9,[]
709,hp3hrj0,rjayn9,1639865139.0,Wnpgcisco,r/technews,On par with the latest Star Trek shows!,0,rjayn9,[]
710,hp3j4zb,rjayn9,1639865801.0,Albertjweasel,r/technews,"Downvote for paywall, but tardigrades rock, bonus points for anyone that can explain their name, is it Latin?",0,rjayn9,[]
711,hp3nd9x,rjayn9,1639867838.0,buzzable,r/technews,Name one thing a tardigrade _doesn't_ survive?,0,rjayn9,[]
712,hp45g2r,rjayn9,1639876872.0,llllllllllllllll12,r/technews,Absolutely disgusting what people are willing to do to sentient animals in the name of science! WATER BEARS LIVES MATTER!,0,rjayn9,[]
713,hp48b5s,rjayn9,1639878337.0,Gilbert-Morrow,r/technews,"I survive strange quantum states everyday, 2021 and on will continue to be a strange quantum states.",0,rjayn9,[]
714,hp4fudx,rjayn9,1639882096.0,JayRyan76,r/technews,I know none of these words,0,rjayn9,[]
715,hp4fzj0,rjayn9,1639882166.0,hossaepi,r/technews,Feels like a spoiler tag is needed if you’re going to post the plot of the new Ant Man movie,0,rjayn9,[]
716,hp4pn47,rjayn9,1639887118.0,Warchild0311,r/technews,We may yet survive the dark forest,0,rjayn9,[]
717,hp4pzug,rjayn9,1639887301.0,ostiDeCalisse,r/technews,Spooky tardigrades… at a distance.,0,rjayn9,[]
718,hp4srqh,rjayn9,1639888837.0,Financial_Bird_7717,r/technews,Hey wait I’ve seen this one before…,0,rjayn9,[]
719,hp4th3z,rjayn9,1639889247.0,Swordf1sh_,r/technews,Discovery fans like 👀,0,rjayn9,[]
720,hp4vria,rjayn9,1639890587.0,Exmachinakelley,r/technews,Pay wall and fake pic,0,rjayn9,[]
721,hp5a94k,rjayn9,1639900642.0,Athenos132,r/technews,Schrodinger's tardigrade.,0,rjayn9,[]
722,hp5aaej,rjayn9,1639900670.0,star-belly-sneetch,r/technews,"Even though the a lot of the life on Earth is probably fucked within this century, news about tardigrades always cheers me up a bit knowing that they'll get along just fine.",0,rjayn9,[]
723,hp5jz4x,rjayn9,1639908817.0,Schwifty_rick_369,r/technews,Tardigrades are the most interesting living beings in the known universe,0,rjayn9,[]
724,hp5kara,rjayn9,1639909097.0,rdumke123,r/technews,Here is the original article: https://arxiv.org/abs/2112.07978,0,rjayn9,[]
725,hp6bdqd,rjayn9,1639927096.0,LeaderAppropriate420,r/technews,"Doesnt everything exist in a quantum state?  Arent we all surviving the entangment?  And on a side note, is that butt or face?  The nails on the other end throw me off",0,rjayn9,[]
726,hp6n08n,rjayn9,1639932268.0,AnimalsNotFood,r/technews,Can someone explain quantum entanglement like you're explaining to a 5yr old?,0,rjayn9,[]
727,hp70os1,rjayn9,1639937840.0,Opening-Throat-9126,r/technews,I’m getting David Lynch’s 1984 Dune vibes.,0,rjayn9,[]
728,hp71c8w,rjayn9,1639938103.0,57hz,r/technews,Black Alert!!!,0,rjayn9,[]
729,hp8fqxu,rjayn9,1639959407.0,Disastrous_Safety_96,r/technews,Leave it to a tardigrade.,0,rjayn9,[]
730,hp2cgkm,rjayn9,1639846541.0,RLDKA,r/technews,Paywall. Downvoted. Interesting story tho,0,rjayn9,[]
731,hp2ewsf,rjayn9,1639847625.0,HOAVicePresident,r/technews,Not to be confused with Jada Pinkett Smith’s quantum entanglement,0,rjayn9,[]
732,hp2rmzw,rjayn9,1639853151.0,nightraid_13,r/technews,Next location is gonna be the shadow realm from Yu Gi Oh,0,rjayn9,[]
733,hp2sgl2,rjayn9,1639853507.0,mcilrain,r/technews,What a tard.,0,rjayn9,[]
734,hp3429j,rjayn9,1639858692.0,AestheticSalt,r/technews,Ban paywall posts! Fuck you,0,rjayn9,[]
735,hp3ohrq,rjayn9,1639868388.0,red_tsuki,r/technews,It must be mentioned that there’s nothing of scientific significance coming from this paper,0,rjayn9,[]
736,hp54wit,rjayn9,1639896499.0,maktus,r/technews,"I once saw a tardigrade take out a monkey.

You don't want to mess with them.",0,rjayn9,[]
737,hp2kfdx,rjayn9,1639850025.0,pimpcaddywillis,r/technews,And time travel begins.,0,rjayn9,[]
738,hp2pyb8,rjayn9,1639852409.0,frupp110,r/technews,Alabama? Roll Tidigrade,0,rjayn9,[]
739,hp2r3vb,rjayn9,1639852918.0,gofyourselftoo,r/technews,Paywall.,0,rjayn9,[]
740,hp2s542,rjayn9,1639853371.0,jbarlak,r/technews,Wow looks like what we saw in antman,0,rjayn9,[]
741,hp2sczc,rjayn9,1639853463.0,RubySplinters,r/technews,OMG,0,rjayn9,[]
742,hp2tc7l,rjayn9,1639853886.0,b33pb00p101,r/technews,When will they understand.,0,rjayn9,[]
743,hp2u2et,rjayn9,1639854204.0,MotoRoaster,r/technews,Do we not learn? This is how you get Stranger Things!,0,rjayn9,[]
744,hp2vj7r,rjayn9,1639854842.0,nprovench789,r/technews,Did anyone watch Harbinger Down were fucked.,0,rjayn9,[]
745,hp2wi0i,rjayn9,1639855269.0,CMtheory,r/technews,Now we can complete said time heist,0,rjayn9,[]
746,hp2y24r,rjayn9,1639855962.0,Joenutz13,r/technews,Entangled like Jada Pinket Smith,0,rjayn9,[]
747,hp2yyzs,rjayn9,1639856376.0,Ill-Radish7700,r/technews,Isn’t that the thing Jada got stuck in?,0,rjayn9,[]
748,hp31fz7,rjayn9,1639857503.0,EssenceHeaded,r/technews,420 hours? Nice.,0,rjayn9,[]
749,hp31m4k,rjayn9,1639857581.0,jamesmcdash,r/technews,"Waterbear in this reality, cuthulu in the next?",0,rjayn9,[]
750,hp31ylv,rjayn9,1639857738.0,ChayFrank1234,r/technews,"But what does it mean for it to be “entangled”? It got very cold and lived, I get that, but what are the implications of it being entangled?",0,rjayn9,[]
751,hp33ei6,rjayn9,1639858392.0,Keller-oder-C-Schell,r/technews,"Don’t know what that means, sounds cool though!",0,rjayn9,[]
752,hp34tb1,rjayn9,1639859036.0,TheAssEatingShasherr,r/technews,these mfs are software bugs in our simulation,0,rjayn9,[]
753,hp35b84,rjayn9,1639859263.0,Ok_Marionberry_9932,r/technews,Isn’t this how they created a giant aggressive killer tardigrade on Star Trek?,0,rjayn9,[]
754,hp37apu,rjayn9,1639860169.0,VirtualKeenu,r/technews,"Entanglement is way too complicated to be vulgarized in such few words imo. 

I'm more interested in the extreme conditions the tardigrades were able to survive to make these experiments.",0,rjayn9,[]
755,hp37m9e,rjayn9,1639860315.0,acatisadog,r/technews,"To be faster, let's make a list of everything that can actually kill a tardigrade. I'll start !

1 -",0,rjayn9,[]
756,hp39k26,rjayn9,1639861224.0,Layll318,r/technews,It’s kinda insane all the things you can do to them.,0,rjayn9,[]
757,hp3bql4,rjayn9,1639862258.0,Same-Excuse-3193,r/technews,No wonder they were using it for interstellar travel.,0,rjayn9,[]
758,hp3catt,rjayn9,1639862524.0,cmilla646,r/technews,Tardi-Man!,0,rjayn9,[]
759,hp3dcii,rjayn9,1639863024.0,ugotbabkad,r/technews,You had me at crypto,0,rjayn9,[]
760,hp3ee9j,rjayn9,1639863519.0,LekarzaPieprz,r/technews,Yeah bro I saw Ant-Man and the Wasp also,0,rjayn9,[]
761,hp3ftp0,rjayn9,1639864197.0,Janizzary,r/technews,Schrodinger's tardigrade is alive even when it's dead.,0,rjayn9,[]
762,hp3i7k6,rjayn9,1639865355.0,tektite,r/technews,Damn the paywall kicks in before they explain how they do it.,0,rjayn9,[]
763,hp3jewf,rjayn9,1639865931.0,KyurMeTV,r/technews,These are actually the mice from Hitchhiker’s Guide,0,rjayn9,[]
764,hp3kk44,rjayn9,1639866480.0,Don_Floo,r/technews,So lets mutate them and then they get bigger and we cant kill them. Who needs AI to cleanse the earth of humans.,0,rjayn9,[]
765,hp3kw7l,rjayn9,1639866643.0,hamockin,r/technews,"Grandpa, from outer space!",0,rjayn9,[]
766,hp3lhkb,rjayn9,1639866926.0,WeAreAllGood,r/technews,Beam me up,0,rjayn9,[]
767,hp3n4hu,rjayn9,1639867720.0,astoneworthskipping,r/technews,Of course it has.,0,rjayn9,[]
768,hp3p2ox,rjayn9,1639868671.0,rapalosaur,r/technews,Didn’t we see this in Ant Man?,0,rjayn9,[]
769,hp3p5x2,rjayn9,1639868714.0,andre3kthegiant,r/technews,This is going to start an intergalactic//parallel universe war!,0,rjayn9,[]
770,hp3qspx,rjayn9,1639869499.0,Schonfille,r/technews,"I don’t know what this means, but we’ll find out on the next season of Star Trek: Discovery.",0,rjayn9,[]
771,hp3rhjn,rjayn9,1639869834.0,accoutremama,r/technews,Ii,0,rjayn9,[]
772,hp3s25r,rjayn9,1639870114.0,cgerst,r/technews,"Wow look Timmy, they’re doing the hokey pokey!",0,rjayn9,[]
773,hp3sbvl,rjayn9,1639870245.0,jfp1992,r/technews,They really are absolute units,0,rjayn9,[]
774,hp3tecu,rjayn9,1639870770.0,monkey-2020,r/technews,Later on in history he will be honored as the first creature to be teleported.,0,rjayn9,[]
775,hp3u1na,rjayn9,1639871090.0,dizzylizzy0722,r/technews,I sincerely get anxiety looking at this picture I can’t explain it,0,rjayn9,[]
776,hp3upjo,rjayn9,1639871411.0,ihopeicanforgive,r/technews,Eli5?,0,rjayn9,[]
777,hp3vj4s,rjayn9,1639871816.0,Suitable_Dress8291,r/technews,Quantum computing organism is what I got? Lol,0,rjayn9,[]
778,hp3w93h,rjayn9,1639872172.0,DeerBoyDiary,r/technews,Literally Antman,0,rjayn9,[]
779,hp3wr97,rjayn9,1639872417.0,slackmaster007,r/technews,"Voted “Most Durable Critter” in 2020, tardigrades lost some of the shine of the award to a pandemic we are all tired f hearing about.  But with this quantum thing they have aggressively reasserted their dominance in the survival game.   Go Tards!",0,rjayn9,[]
780,hp3x76v,rjayn9,1639872636.0,Attack-Cat-,r/technews,"So has everyone technically. Every time you are alone in a room no one else technically knows you’re alive until you emerge or they go in. Writing this alone right now; as soon as I hit send I will emerge from my “strange” quantum state of possible non existence.

Tardigrades: can survive in vacuum and are now every sci fi writers and tech columnists wet dream.",0,rjayn9,[]
781,hp3xhym,rjayn9,1639872784.0,bdubb_dlux,r/technews,Black Alert,0,rjayn9,[]
782,hp3y114,rjayn9,1639873053.0,mightydanbearpig,r/technews,It’s like the grown up scientist version of putting a fly in the microwave to see what happens when you turn it on.,0,rjayn9,[]
783,hp3y2yi,rjayn9,1639873079.0,Aquajolt409,r/technews,The Tardigrade is a Trojan Horse for Kang the Conqueror.,0,rjayn9,[]
784,hp3yq0q,rjayn9,1639873399.0,Smack_Laboratory,r/technews,I always thought a tardigrade was when you handed in an assignment late.,0,rjayn9,[]
785,hp3zddv,rjayn9,1639873738.0,Glorious_Centaur,r/technews,"I don’t understand. Are there two tardigrades now, doing the same thing?",0,rjayn9,[]
786,hp3zp26,rjayn9,1639873908.0,BoringWozniak,r/technews,How many Infinity Stones did it come back with,0,rjayn9,[]
787,hp3zut4,rjayn9,1639873992.0,Digitaj,r/technews,Why are we messing with the one thing in existence that can survive almost anything. Seems like a bad idea.,0,rjayn9,[]
788,hp402ss,rjayn9,1639874106.0,mcataldo731,r/technews,"Tardigrades don’t play no shit, you feel me? Tardigrades ain’t never been about playin no shit",0,rjayn9,[]
789,hp408ho,rjayn9,1639874186.0,Larnievc,r/technews,Isn’t this the plot is Star Trek Disco?,0,rjayn9,[]
790,hp40fpl,rjayn9,1639874291.0,_IBM_,r/technews,they're fricken quantum proof too now?!,0,rjayn9,[]
791,hp40jsa,rjayn9,1639874350.0,Radiant-Wrongdoer-93,r/technews,antman,0,rjayn9,[]
792,hp4183d,rjayn9,1639874701.0,azimutton,r/technews,"soon there will be a federation of wierd quantum states, one of them with a water bear in their flag",0,rjayn9,[]
793,hp41goy,rjayn9,1639874824.0,2h2o22h2o,r/technews,Schrodinger’s tartigrade.,0,rjayn9,[]
794,hp4224z,rjayn9,1639875131.0,Suitable_Designer_67,r/technews,Your job ever been so hard you come home and hibernate through quantum entanglement. Still wake up and ask for 5 more minutes,0,rjayn9,[]
795,hp42d3q,rjayn9,1639875289.0,academically-gosh9,r/technews,"this is largely nonsense, like saying my teddy bear has been psychoanalised.",0,rjayn9,[]
796,hp42i4x,rjayn9,1639875361.0,lea949,r/technews,"Hella cool, I’m sure! But… aren’t these the little guys that can survive the vacuum of space too?",0,rjayn9,[]
797,hp49w2o,rjayn9,1639879124.0,livonyote,r/technews,Whatever that means,0,rjayn9,[]
798,hp4aq9x,rjayn9,1639879543.0,2CBnumberonefan,r/technews,They put it in a box and closed it. Guess fate was on the creature’s side when scientists went to check whether it was alive.,0,rjayn9,[]
799,hp4dpjc,rjayn9,1639881019.0,nerofan5,r/technews,Was it a frightening liminal space between states of being?,0,rjayn9,[]
800,hp4e0h4,rjayn9,1639881172.0,Zyxarde,r/technews,"Don’t viruses also go inert, this definitely makes a compelling argument for viruses to be considered living does it not?",0,rjayn9,[]
801,hp4fe82,rjayn9,1639881869.0,theoneronin,r/technews,Splice me up,0,rjayn9,[]
802,hp4fu04,rjayn9,1639882090.0,Darkadmks,r/technews,Ant-Man 3 plot reveal,0,rjayn9,[]
803,hp4hqy2,rjayn9,1639883065.0,schrodingers_spider,r/technews,Now we know how the events of Half Life started.,0,rjayn9,[]
804,hp4k9i0,rjayn9,1639884346.0,_m_a_r_t_y__c_123,r/technews,Lol it’s the guy from ant man 2,0,rjayn9,[]
805,hp4khan,rjayn9,1639884456.0,Bluejay6701,r/technews,Poor guy hope he’s fine and can return to doing what he’s been doing,0,rjayn9,[]
806,hp4lcsl,rjayn9,1639884901.0,Arcade1980,r/technews,Pretty soon the tardagrade will pilot a spore drive.,0,rjayn9,[]
807,hp4m36t,rjayn9,1639885283.0,Volkov537,r/technews,You and me both tardigrade…,0,rjayn9,[]
808,hp4mbue,rjayn9,1639885410.0,iFooFlec,r/technews,What’s a quantum state,0,rjayn9,[]
809,hp4mitd,rjayn9,1639885515.0,norpiano,r/technews,I understood a couple words in that title,0,rjayn9,[]
810,hp4mrp2,rjayn9,1639885645.0,fwagglesworth,r/technews,"Wait, so was the tardigrade “entangled” or just placed between two entangled qubits?  Why is this notable?  Is it an early proof that entanglement based tech isn’t dangerous?",0,rjayn9,[]
811,hp4n93o,rjayn9,1639885892.0,exhibitionista,r/technews,"Does this suggest that tardigrades, given the opportunity, would survive interstellar travel in the vacuum of space and colonise other planets?",0,rjayn9,[]
812,hp4nk7u,rjayn9,1639886053.0,skobuffaloes,r/technews,Could we encode data via DNA injection into the tardigrade and have it be quantum entangled. Then bring it back out and see if the DNA is the same? Proving something something.,0,rjayn9,[]
813,hp4o8vp,rjayn9,1639886410.0,Brushy-Hill,r/technews,This is cool until we learn that all humans reincarnate as tardigrades…,0,rjayn9,[]
814,hp4x3x2,rjayn9,1639891396.0,Comin-right-tortoise,r/technews,And somebody let a bunch of these things loose in space…,0,rjayn9,[]
815,hp2ildj,rjayn9,1639849232.0,uluqat,r/technews,"If Paul Stamets goes to space anytime soon, call a Code Black.",0,rjayn9,[]
816,hp335fh,rjayn9,1639858279.0,S_SubZero,r/technews,"“Ziggy says… this one is a bit complicated….”

*blurbles* Oh boy.",0,rjayn9,[]
817,hp5ftsn,rjayn9,1639905255.0,Chicxulub2068,r/technews,"Tardigafes survive in space, but they can’t even survive climate change. 

Seriously.

Tardigrades won’t make it to 2200",0,rjayn9,[]
818,hp5xs6h,rjayn9,1639919700.0,absolute-morality,r/technews,hate to be the bearer of bad news but this never happened,0,rjayn9,[]
819,hp6zzet,rjayn9,1639937556.0,steamngine,r/technews,"Lies, just funding click bait",0,rjayn9,[]
820,hp4wvkc,rjayn9,1639891257.0,non-member,r/technews,"Tardigrades, the secret ingredient in future quantum processors…?",0,rjayn9,[]
821,hp4xjuu,rjayn9,1639891666.0,mkshdnna,r/technews,enter the tardiverse,0,rjayn9,[]
822,hp4y3if,rjayn9,1639891988.0,BeenThereReddit_That,r/technews,Heavy weight champion of the universe!,0,rjayn9,[]
823,hp4z5ur,rjayn9,1639892624.0,Coheed_SURVIVE,r/technews,"What does being entangled mean exactly? If the tardigrade makes a movement, the thing it was entangled to does the opposite/parallel movement? Please help this ignorant fool understand.",0,rjayn9,[]
824,hp50h3z,rjayn9,1639893448.0,Maelstrom_Witch,r/technews,"I am either too stoned or not stoned enough to understand the “entanglement” part, but I really enjoyed some of the explanations.",0,rjayn9,[]
825,hp50jf1,rjayn9,1639893491.0,Freshprinceaye,r/technews,This is a small but very amazing.,0,rjayn9,[]
826,hp51m5q,rjayn9,1639894200.0,outlookunsettled,r/technews,They are fascinating little dudes,0,rjayn9,[]
827,hp521hp,rjayn9,1639894487.0,Natural-Brain5255,r/technews,Good for him,0,rjayn9,[]
828,hp57tra,rjayn9,1639898709.0,Cruccagna,r/technews,Disco fans are not surprised,0,rjayn9,[]
829,hp5aww6,rjayn9,1639901170.0,kelly_hasegawa,r/technews, i think we need to prioritize solving the mysteries of these mfs. They are really strange one of a kind creature.,0,rjayn9,[]
830,hp5c9ba,rjayn9,1639902283.0,419Patrone,r/technews,What do they eat? 😀,0,rjayn9,[]
