,comment_id,article_id,date,username,from_where,body,level,parent_comment_id,replies_ids
1626,j08f5fs,zloibj,1671050058.0,JustHereFriends,r/technews,This reminds me of the fact that light moves different when observed as opposed to when un-observed,0,zloibj,[]
1627,j06my5c,zloibj,1671024536.0,caring_impaired,r/technews,"If you had told me ten years ago that researchers would discover “quantum time flips” that makes light move simultaneously forward and backward in time, I wouldn’t have cared then either.",0,zloibj,[]
1628,j06lyq5,zloibj,1671024017.0,DonnaScro321,r/technews,There is no “time” it-is a construct-forward and back because we said so. Light is not aware of our labels so light is just doing its thing🙏🏼Namaste,0,zloibj,[]
1629,j06q5ho,zloibj,1671026096.0,UltimateUltamate,r/technews,This explains why the lights in my office are so fucking annoying.,0,zloibj,[]
1630,j06nwyz,zloibj,1671025039.0,MaBonneVie,r/technews,"Really? Where is the math and science behind this? Oh, I see: there’s not any.",0,zloibj,[]
1631,j06keaa,zloibj,1671023188.0,SalsaBueno,r/technews,Because science is *WIERD*!!!,0,zloibj,[]
1632,j06kt2z,zloibj,1671023410.0,kakacon,r/technews,Feels very qubit like,0,zloibj,[]
1633,j06qha6,zloibj,1671026244.0,Thebadmamajama,r/technews,"""scream real loud kids, and we'll go backwards and forwards, at the same time!!!!""",0,zloibj,[]
1634,j06rgec,zloibj,1671026695.0,MrPunkerton,r/technews,"If you made light in an experiment move simultaneously backwards in time as it does forward….. wouldn’t you see light in the space your creating it just prior to the experiment…… as momentarily your about to send light back from a moment that hasn’t happened yet  in the same position? But then again, we’re rotating, traveling around the Sun and Milky Way, and god knows what else, so who knows where sending something back in time would cause it’s appearance to another traveler in that space time",0,zloibj,[]
1635,j06rwoe,zloibj,1671026897.0,Glittering-Sir-9345,r/technews,How did they observe something moving forward in time unless they moved forward in time also?,0,zloibj,[]
1636,j06ss6j,zloibj,1671027292.0,1Originalmind,r/technews,So correct me if im wrong but wouldn’t any movement in any direction from a static point in space be considered forward movement in time?,0,zloibj,[]
1637,j06tghq,zloibj,1671027605.0,UltiGamer34,r/technews,Time travel anyone,0,zloibj,[]
1638,j06z2b6,zloibj,1671030038.0,FuriousBugger,r/technews,Call me when they are moving sideways in time…,0,zloibj,[]
1639,j06zt8d,zloibj,1671030354.0,Teamnoq,r/technews,Well this explains my week and why the answer was 47.,0,zloibj,[]
1640,j071e1n,zloibj,1671031001.0,sturmbrightblade69,r/technews,I think this has been proven and we can look back in the past. My proof? The Simpsons!,0,zloibj,[]
1641,j071yhh,zloibj,1671031233.0,toxicsleft,r/technews,Are you telling me of all the time travel theories we live in we ended up living in the “Tenet” one?,0,zloibj,[]
1642,j077m8h,zloibj,1671033474.0,A-Good-Weather-Man,r/technews,Hey i think i saw this in Tenet? Or i haven’t yet. Idk that movie changed me,0,zloibj,[]
1643,j07azv0,zloibj,1671034819.0,idk-SUMn-Amazing004,r/technews,So does a Jedi flip 😉,0,zloibj,[]
1644,j07fyl5,zloibj,1671036746.0,Captain_Slapass,r/technews,Sooooooo… Time travel?,0,zloibj,[]
1645,j07i66x,zloibj,1671037597.0,usone32,r/technews,"It's not traveling backwards and forward through time at the same time, it's all happening at the exact same moment in time.",0,zloibj,[]
1646,j07i8qr,zloibj,1671037624.0,Radvillainy,r/technews,that's crazy man,0,zloibj,[]
1647,j07imua,zloibj,1671037772.0,The_FuckworkOrange,r/technews,Wake me up when they publish a quantum time double gainer. Then I will be impressed. /s,0,zloibj,[]
1648,j07kcki,zloibj,1671038425.0,Active-Sky-M31,r/technews,We’re about to be enlightened.,0,zloibj,[]
1649,j07o4sd,zloibj,1671039865.0,CMDR_KingErvin,r/technews,Moves simultaneously forward and backwards? So… it stayed in the same place?,0,zloibj,[]
1650,j07o85e,zloibj,1671039900.0,bootstrapsandpearls,r/technews,I’ll take my Tardis in dark blue please.,0,zloibj,[]
1651,j07ooxp,zloibj,1671040076.0,apocaghost,r/technews,Your just creating a null field and the light moving backward is just an illusion. It is more folding back on itself. It is still a remarkable achievement for such an uneducated species. It could be used to propel objects and data at the speed of light. I would not put a living creature in one that would be messy.,0,zloibj,[]
1652,j082krq,zloibj,1671045373.0,Ok_Marionberry_9932,r/technews,Garbage. Nothing can move backwards in time,0,zloibj,[]
1653,j08f8mx,zloibj,1671050092.0,substituted_pinions,r/technews,Bait title fo sho.  Missing the crucial _peer review_ process.,0,zloibj,[]
1654,j08ftoj,zloibj,1671050309.0,-Alter-Reality-,r/technews,"Let me get this straight, if it goes forward AND back simultaneously, does it just not move?",0,zloibj,[]
1655,j08goq6,zloibj,1671050622.0,gerberag,r/technews,"Given the speed of the Earth through the universe, light is about the only thing fast enough that you might be able to track going back in time.",0,zloibj,[]
1656,j08od1i,zloibj,1671053507.0,ZealousidealWinner,r/technews,My brain hurts,0,zloibj,[]
1657,j08y9r7,zloibj,1671057473.0,bakedbeebs,r/technews,could you not,0,zloibj,[]
1658,j097ash,zloibj,1671061294.0,ChancellorScalpatine,r/technews,Seems like one of those tech anomalies in Stellaris,0,zloibj,[]
1659,j09eroq,zloibj,1671064606.0,Gundam_Greg,r/technews,"People on here be like, let’s see Paul Allens peer review.",0,zloibj,[]
1660,j09kpyv,zloibj,1671067307.0,Trax852,r/technews,If you split a photon you know where it is.,0,zloibj,[]
1661,j09ug9p,zloibj,1671071632.0,Ok-Swimming8024,r/technews,How in the hell do these stupid science bitches understand this stuff?,0,zloibj,[]
1662,j0a5nk0,zloibj,1671076848.0,tea_leaves_69,r/technews,The time warp?,0,zloibj,[]
1663,j0a6fi9,zloibj,1671077237.0,Dapper_Cable_4929,r/technews,oh no you didn’t,0,zloibj,[]
1664,j0aan12,zloibj,1671079459.0,EnvironmentalWrap167,r/technews,"I am no physicist, but as I understand, photons do not experience time.",0,zloibj,[]
1665,j0ad627,zloibj,1671080892.0,konhaybay,r/technews,Quantam………leap!!!!,0,zloibj,[]
1666,j0adi3o,zloibj,1671081089.0,Archibald_80,r/technews,"So, “middle out”?",0,zloibj,[]
1667,j0alb9q,zloibj,1671086111.0,Apprehensive-Load917,r/technews,Destiny loading screen,0,zloibj,[]
1668,j0aoslp,zloibj,1671088612.0,ShowPuzzleheaded7529,r/technews,Doesn't that just mean it's standing still?,0,zloibj,[]
1669,j0atptw,zloibj,1671092443.0,Hyracotherium,r/technews,"""The researchers created their time-flipped photon out of intellectual curiosity, but follow-up experiments showed that time flips can be paired with reversible logic gates to enable simultaneous computation in either direction, thus opening the way for quantum processors with greatly enhanced processing power.""

This is cool!!!! I think.",0,zloibj,[]
1670,j0beib3,zloibj,1671108347.0,Mr_Mojo_Risin_83,r/technews,How do you go about measuring something going backwards in time?,0,zloibj,[]
1671,j0c5b5i,zloibj,1671120396.0,turqeee,r/technews,Tenet irl confirmed,0,zloibj,[]
1672,j0ci6gp,zloibj,1671125325.0,TheFoxandTheSandor,r/technews,Damn you daylights savings!!!,0,zloibj,[]
1673,j0en299,zloibj,1671156540.0,naslam74,r/technews,Reading about Quantum Physics relaxes me. I don’t know why.,0,zloibj,[]
1674,j0evsp2,zloibj,1671160563.0,wolfford,r/technews,"It is possible to manipulate the time evolution of a quantum system in certain circumstances. One way to do this is through the use of a quantum time evolution operator, which describes how a quantum system changes over time.

In the case of the ""quantum time flip"", the researchers used a special optical crystal to split a photon, or packet of light, into two paths. One path traveled through the crystal, while the other path did not. The researchers found that the path of the photon through the crystal exhibited a temporal behavior known as ""time reversal,"" in which the photon appeared to travel backward in time.

This effect is not the same as true time travel, as it does not involve the actual reversal of the flow of time. Instead, it is a quantum phenomenon that arises due to the way that the quantum system is prepared and measured.

It is important to note that this type of quantum time manipulation is still a subject of active research and is not fully understood. Further study is needed to better understand the underlying mechanisms and potential applications of these phenomena.",0,zloibj,[]
1675,j0ffuj7,zloibj,1671171675.0,ilde86,r/technews,Time happens all at once consciousness forces time into a linear construct,0,zloibj,[]
1676,j07r07g,zloibj,1671040950.0,Chimaerok,r/technews,Not peer reviewed and unverified.,0,zloibj,[]
1677,j07xd9j,zloibj,1671043392.0,NevarNi-RS,r/technews,Bro invented a mirror? What’s the big deal,0,zloibj,[]
1678,j06kapa,zloibj,1671023134.0,Badaxe13,r/technews,"Sounds incredible, but *""the findings have yet to be peer-reviewed""*",0,zloibj,[]
1679,j06cr0l,zloibj,1671018387.0,MammothWalwort,r/technews,Can anybody r/explainlikeimfive ?,0,zloibj,[]
1680,j06spaq,zloibj,1671027255.0,Shoelacious,r/technews,"This is a decent article. Research teams made a variation on the double-slit experiment, basically, which resulted in photons whose quantum superposition combined having been changed and not having been changed. Headline is misleading: interpret as though forward/backward were clockwise/counterclockwise.",0,zloibj,[]
1681,j088psw,zloibj,1671047680.0,Rupert80027,r/technews,Can confirm.  Ate too many edibles once and time flowed both ways.  Took me 36 hours for the 3 hours to sober up with all the back and forth.,0,zloibj,[]
1682,j06e0eq,zloibj,1671019254.0,Shooeytv,r/technews,science is off it’s meds,0,zloibj,[]
1683,j06wwfr,zloibj,1671029119.0,JonathanL73,r/technews,Quantum physics is so weird.,0,zloibj,[]
1684,j06keyb,zloibj,1671023198.0,MuthaPlucka,r/technews,Schrödinger‘s lightbulb,0,zloibj,[]
1685,j086an2,zloibj,1671046777.0,buddingtechhelper,r/technews,"You fools! Do they not realize the power of adding Quantum to something! It makes it time travel, this is basic shit. Stupid science bitch got donkey brains",0,zloibj,[]
1686,j06s3x2,zloibj,1671026988.0,strolpol,r/technews,"Getting a distinctly Stein’s Gate vibe, wonder if they can send a text message that way eventually",0,zloibj,[]
1687,j06sktw,zloibj,1671027200.0,kirkerandrews,r/technews,   Sooooo…we can time travel rite? ‘Cause that’s what everyone wants to take away from this vague non peer-reviewed article with no supporting math or explanation,0,zloibj,[]
1688,j078rhe,zloibj,1671033933.0,Believe_In-Steven,r/technews,"Wow, I did not see that coming. 🤔😂",0,zloibj,[]
1689,j07dsqm,zloibj,1671035914.0,Pinche_Pocho,r/technews,"Comon man, don’t lay this on my doorstep before my first bong hit.",0,zloibj,[]
1690,j07gop8,zloibj,1671037023.0,Firm_Masterpiece_343,r/technews,One step closer to creating a butterfly effect. I have complete faith that some scientist is going to find something that’ll destroy everything.,0,zloibj,[]
1691,j07pbau,zloibj,1671040310.0,MrPhraust,r/technews,"Ahaha! Only came here to express my extreme excitement about this idea - it matches a quantum theory I began working on as a teenager over 20 years ago!!!! I have been wracking my brain with this theory and have been stuck on a few mathematical equations! Now is the time!

Thanks for posting the is OP!!",0,zloibj,[]
1692,j07ubhk,zloibj,1671042229.0,-xstatic-,r/technews,This sounds similar to the “time crystals” that were discovered recently,0,zloibj,[]
1693,j080rtp,zloibj,1671044681.0,GivinItAllThat,r/technews,"So they are pushing light back and forth forever?  

))<>((",0,zloibj,[]
1694,j084af8,zloibj,1671046035.0,DeafDogs_DriveSlow,r/technews,"If you are interested in this topic (the flow/physics/perception of time), I highly recommend the book “The Order of Time” by Carlo Rovelli.

The book focuses on the question of “what is time?”, and digs into this notion of why/how time can move in either direction (toward the future or the past), the physics and philosophical implications.",0,zloibj,[]
1695,j08f5fs,zloibj,1671050058.0,JustHereFriends,r/technews,This reminds me of the fact that light moves different when observed as opposed to when un-observed,0,zloibj,[]
1696,j06my5c,zloibj,1671024536.0,caring_impaired,r/technews,"If you had told me ten years ago that researchers would discover “quantum time flips” that makes light move simultaneously forward and backward in time, I wouldn’t have cared then either.",0,zloibj,[]
1697,j06lyq5,zloibj,1671024017.0,DonnaScro321,r/technews,There is no “time” it-is a construct-forward and back because we said so. Light is not aware of our labels so light is just doing its thing🙏🏼Namaste,0,zloibj,[]
1698,j06q5ho,zloibj,1671026096.0,UltimateUltamate,r/technews,This explains why the lights in my office are so fucking annoying.,0,zloibj,[]
1699,j06nwyz,zloibj,1671025039.0,MaBonneVie,r/technews,"Really? Where is the math and science behind this? Oh, I see: there’s not any.",0,zloibj,[]
1700,j06keaa,zloibj,1671023188.0,SalsaBueno,r/technews,Because science is *WIERD*!!!,0,zloibj,[]
1701,j06kt2z,zloibj,1671023410.0,kakacon,r/technews,Feels very qubit like,0,zloibj,[]
1702,j06qha6,zloibj,1671026244.0,Thebadmamajama,r/technews,"""scream real loud kids, and we'll go backwards and forwards, at the same time!!!!""",0,zloibj,[]
1703,j06rgec,zloibj,1671026695.0,MrPunkerton,r/technews,"If you made light in an experiment move simultaneously backwards in time as it does forward….. wouldn’t you see light in the space your creating it just prior to the experiment…… as momentarily your about to send light back from a moment that hasn’t happened yet  in the same position? But then again, we’re rotating, traveling around the Sun and Milky Way, and god knows what else, so who knows where sending something back in time would cause it’s appearance to another traveler in that space time",0,zloibj,[]
1704,j06rwoe,zloibj,1671026897.0,Glittering-Sir-9345,r/technews,How did they observe something moving forward in time unless they moved forward in time also?,0,zloibj,[]
1705,j06ss6j,zloibj,1671027292.0,1Originalmind,r/technews,So correct me if im wrong but wouldn’t any movement in any direction from a static point in space be considered forward movement in time?,0,zloibj,[]
1706,j06tghq,zloibj,1671027605.0,UltiGamer34,r/technews,Time travel anyone,0,zloibj,[]
1707,j06z2b6,zloibj,1671030038.0,FuriousBugger,r/technews,Call me when they are moving sideways in time…,0,zloibj,[]
1708,j06zt8d,zloibj,1671030354.0,Teamnoq,r/technews,Well this explains my week and why the answer was 47.,0,zloibj,[]
1709,j071e1n,zloibj,1671031001.0,sturmbrightblade69,r/technews,I think this has been proven and we can look back in the past. My proof? The Simpsons!,0,zloibj,[]
1710,j071yhh,zloibj,1671031233.0,toxicsleft,r/technews,Are you telling me of all the time travel theories we live in we ended up living in the “Tenet” one?,0,zloibj,[]
1711,j077m8h,zloibj,1671033474.0,A-Good-Weather-Man,r/technews,Hey i think i saw this in Tenet? Or i haven’t yet. Idk that movie changed me,0,zloibj,[]
1712,j07azv0,zloibj,1671034819.0,idk-SUMn-Amazing004,r/technews,So does a Jedi flip 😉,0,zloibj,[]
1713,j07fyl5,zloibj,1671036746.0,Captain_Slapass,r/technews,Sooooooo… Time travel?,0,zloibj,[]
1714,j07i66x,zloibj,1671037597.0,usone32,r/technews,"It's not traveling backwards and forward through time at the same time, it's all happening at the exact same moment in time.",0,zloibj,[]
1715,j07i8qr,zloibj,1671037624.0,Radvillainy,r/technews,that's crazy man,0,zloibj,[]
1716,j07imua,zloibj,1671037772.0,The_FuckworkOrange,r/technews,Wake me up when they publish a quantum time double gainer. Then I will be impressed. /s,0,zloibj,[]
1717,j07kcki,zloibj,1671038425.0,Active-Sky-M31,r/technews,We’re about to be enlightened.,0,zloibj,[]
1718,j07o4sd,zloibj,1671039865.0,CMDR_KingErvin,r/technews,Moves simultaneously forward and backwards? So… it stayed in the same place?,0,zloibj,[]
1719,j07o85e,zloibj,1671039900.0,bootstrapsandpearls,r/technews,I’ll take my Tardis in dark blue please.,0,zloibj,[]
1720,j07ooxp,zloibj,1671040076.0,apocaghost,r/technews,Your just creating a null field and the light moving backward is just an illusion. It is more folding back on itself. It is still a remarkable achievement for such an uneducated species. It could be used to propel objects and data at the speed of light. I would not put a living creature in one that would be messy.,0,zloibj,[]
1721,j082krq,zloibj,1671045373.0,Ok_Marionberry_9932,r/technews,Garbage. Nothing can move backwards in time,0,zloibj,[]
1722,j08f8mx,zloibj,1671050092.0,substituted_pinions,r/technews,Bait title fo sho.  Missing the crucial _peer review_ process.,0,zloibj,[]
1723,j08ftoj,zloibj,1671050309.0,-Alter-Reality-,r/technews,"Let me get this straight, if it goes forward AND back simultaneously, does it just not move?",0,zloibj,[]
1724,j08goq6,zloibj,1671050622.0,gerberag,r/technews,"Given the speed of the Earth through the universe, light is about the only thing fast enough that you might be able to track going back in time.",0,zloibj,[]
1725,j08od1i,zloibj,1671053507.0,ZealousidealWinner,r/technews,My brain hurts,0,zloibj,[]
1726,j08y9r7,zloibj,1671057473.0,bakedbeebs,r/technews,could you not,0,zloibj,[]
1727,j097ash,zloibj,1671061294.0,ChancellorScalpatine,r/technews,Seems like one of those tech anomalies in Stellaris,0,zloibj,[]
1728,j09eroq,zloibj,1671064606.0,Gundam_Greg,r/technews,"People on here be like, let’s see Paul Allens peer review.",0,zloibj,[]
1729,j09kpyv,zloibj,1671067307.0,Trax852,r/technews,If you split a photon you know where it is.,0,zloibj,[]
1730,j09ug9p,zloibj,1671071632.0,Ok-Swimming8024,r/technews,How in the hell do these stupid science bitches understand this stuff?,0,zloibj,[]
1731,j0a5nk0,zloibj,1671076848.0,tea_leaves_69,r/technews,The time warp?,0,zloibj,[]
1732,j0a6fi9,zloibj,1671077237.0,Dapper_Cable_4929,r/technews,oh no you didn’t,0,zloibj,[]
1733,j0aan12,zloibj,1671079459.0,EnvironmentalWrap167,r/technews,"I am no physicist, but as I understand, photons do not experience time.",0,zloibj,[]
1734,j0ad627,zloibj,1671080892.0,konhaybay,r/technews,Quantam………leap!!!!,0,zloibj,[]
1735,j0adi3o,zloibj,1671081089.0,Archibald_80,r/technews,"So, “middle out”?",0,zloibj,[]
1736,j0alb9q,zloibj,1671086111.0,Apprehensive-Load917,r/technews,Destiny loading screen,0,zloibj,[]
1737,j0aoslp,zloibj,1671088612.0,ShowPuzzleheaded7529,r/technews,Doesn't that just mean it's standing still?,0,zloibj,[]
1738,j0atptw,zloibj,1671092443.0,Hyracotherium,r/technews,"""The researchers created their time-flipped photon out of intellectual curiosity, but follow-up experiments showed that time flips can be paired with reversible logic gates to enable simultaneous computation in either direction, thus opening the way for quantum processors with greatly enhanced processing power.""

This is cool!!!! I think.",0,zloibj,[]
1739,j0beib3,zloibj,1671108347.0,Mr_Mojo_Risin_83,r/technews,How do you go about measuring something going backwards in time?,0,zloibj,[]
1740,j0c5b5i,zloibj,1671120396.0,turqeee,r/technews,Tenet irl confirmed,0,zloibj,[]
1741,j0ci6gp,zloibj,1671125325.0,TheFoxandTheSandor,r/technews,Damn you daylights savings!!!,0,zloibj,[]
1742,j0en299,zloibj,1671156540.0,naslam74,r/technews,Reading about Quantum Physics relaxes me. I don’t know why.,0,zloibj,[]
1743,j0evsp2,zloibj,1671160563.0,wolfford,r/technews,"It is possible to manipulate the time evolution of a quantum system in certain circumstances. One way to do this is through the use of a quantum time evolution operator, which describes how a quantum system changes over time.

In the case of the ""quantum time flip"", the researchers used a special optical crystal to split a photon, or packet of light, into two paths. One path traveled through the crystal, while the other path did not. The researchers found that the path of the photon through the crystal exhibited a temporal behavior known as ""time reversal,"" in which the photon appeared to travel backward in time.

This effect is not the same as true time travel, as it does not involve the actual reversal of the flow of time. Instead, it is a quantum phenomenon that arises due to the way that the quantum system is prepared and measured.

It is important to note that this type of quantum time manipulation is still a subject of active research and is not fully understood. Further study is needed to better understand the underlying mechanisms and potential applications of these phenomena.",0,zloibj,[]
1744,j0ffuj7,zloibj,1671171675.0,ilde86,r/technews,Time happens all at once consciousness forces time into a linear construct,0,zloibj,[]
1745,j07r07g,zloibj,1671040950.0,Chimaerok,r/technews,Not peer reviewed and unverified.,0,zloibj,[]
1746,j07xd9j,zloibj,1671043392.0,NevarNi-RS,r/technews,Bro invented a mirror? What’s the big deal,0,zloibj,[]
1747,hmwgsnc,r6x48q,1638425612.0,gewd_vibes_only,r/technews,I knew what each word meant but putting them in that order was a whole new thing... All I can say is that I’m excited about time crystals but I’m not sure why.,0,r6x48q,[]
1748,hmw9uq4,r6x48q,1638421535.0,chiller529,r/technews,"I have no idea what I just read, but it sounded pretty damn cool.",0,r6x48q,[]
1749,hmwq86r,r6x48q,1638432429.0,latebtcinvestor,r/technews,"Tldr
Time no longer exists and you are pure energy experiencing itself through a reddit post",0,r6x48q,[]
1750,hmwlcug,r6x48q,1638428710.0,Mingyao_13,r/technews,Must be some good crystal,0,r6x48q,[]
1751,hmxg3wh,r6x48q,1638451680.0,Ginandexhaustion,r/technews,I saw the time knife !!?!?!!!,0,r6x48q,[]
1752,hmxbg6r,r6x48q,1638449073.0,kagethemage,r/technews,I’ve done enough acid to know this already.,0,r6x48q,[]
1753,hmxue0z,r6x48q,1638458272.0,LordInsidias,r/technews,So uhh after reading this article I have just one burning question…what’s a time crystal?,0,r6x48q,[]
1754,hmxnh0x,r6x48q,1638455261.0,red_fist,r/technews,"TLDR:

It’s a computer simulation which gives results which violate thermodynamics and resonance with other cyclical systems.

It’s a big claim and will need big experimental evidence to validate.",0,r6x48q,[]
1755,hmxuihy,r6x48q,1638458324.0,Bazingakween,r/technews,I’m a physics major and I’m still not sure what’s its significance. Crying brb,0,r6x48q,[]
1756,hmxen9a,r6x48q,1638450893.0,10113r114m4,r/technews,"Is there any use for a time crystal though? Unless we can predict a given pattern at some point in time, it won't be too useful right?",0,r6x48q,[]
1757,hmwllb0,r6x48q,1638428878.0,o0flatCircle0o,r/technews,"Reminds me of Rockwell Automations Retro Encabulator.  
https://youtu.be/RXJKdh1KZ0w",0,r6x48q,[]
1758,hmx94e7,r6x48q,1638447617.0,kaddorath,r/technews,"Uncle Rico’s time machine.

“I forgot to put in the crystals.”",0,r6x48q,[]
1759,hmxkkvv,r6x48q,1638453914.0,rupyneupers,r/technews,Isn’t this already going to happen last year?,0,r6x48q,[]
1760,hmyf4m4,r6x48q,1638466435.0,KiwiofD,r/technews,While my ph.d. was in a different area of nanotechnology and I’m unqualified to review this article. I am always concerned about computer modeling as it operates within the parameters we provide. Unless it is parameterless ai learning. Either may offer an impossible solution if allowed. Although I guess then we devise a test to scientifically prove that solution.,0,r6x48q,[]
1761,hmwjfo1,r6x48q,1638427360.0,bobvilastuff,r/technews,"Everyone in this room is now dumber for having listened to it. I award you no points, and may God have mercy on your soul.",0,r6x48q,[]
1762,hmwuscz,r6x48q,1638436242.0,SomeToxicRivenMain,r/technews,Well this is interesting,0,r6x48q,[]
1763,hmwv6g7,r6x48q,1638436577.0,FantasticMRKintsugi,r/technews,Antman 3 confirmed!,0,r6x48q,[]
1764,hmwy9zp,r6x48q,1638439231.0,Grabthars_Coping_Saw,r/technews,I don’t understand this very well but it sets off Bullshit alarms for me.  Feels overhyped.,0,r6x48q,[]
1765,hmxb2jk,r6x48q,1638448841.0,JealousDemon,r/technews,"Psychic time crystals? Like the kind used to protect against psychic attack?
/s",0,r6x48q,[]
1766,hmxjite,r6x48q,1638453399.0,Specialist_Thing9776,r/technews,"“Alright Morty, hurry up and get those Time Crystals so we can go and play games at Blipz and Chipz!” Wobolobodub dub",0,r6x48q,[]
1767,hmxknbz,r6x48q,1638453946.0,cuxxcruxx,r/technews,"I just tweeted the smith kids to explain this to me. 
Hopefully they can take a break from their terrible entertainment careers and get back to their true passion of quantum physics.",0,r6x48q,[]
1768,hmxkq7s,r6x48q,1638453984.0,legs_are_high,r/technews,I’m gonna smoke it,0,r6x48q,[]
1769,hmxpzlm,r6x48q,1638456382.0,Big__Boss___,r/technews,"Put it wayyyy up there, Morty *beellllcch*",0,r6x48q,[]
1770,hmxta7j,r6x48q,1638457799.0,Whiteboythor,r/technews,Some land of the lost type shit,0,r6x48q,[]
1771,hmxx223,r6x48q,1638459380.0,earthisadonuthole,r/technews,"Ordinary people: you can’t just put time on the front of any random word. This isn’t Dr. Who. 

Physicists: like time hell we can’t!",0,r6x48q,[]
1772,hmxxltx,r6x48q,1638459608.0,In2_The_Blue,r/technews,"Timesplitters has become real life, fuck yeah",0,r6x48q,[]
1773,hmxy8p3,r6x48q,1638459866.0,Nagi21,r/technews,Petition to call Time Crystals “Allons-y’s”,0,r6x48q,[]
1774,hmy1yfr,r6x48q,1638461358.0,mindcontrol93,r/technews,Yog-Sothoth approves,0,r6x48q,[]
1775,hmy3ja4,r6x48q,1638461986.0,Im_So_Hard_Right_Now,r/technews,this is some Marvel shit.,0,r6x48q,[]
