,comment_id,article_id,date,username,from_where,body,level,parent_comment_id,replies_ids
0,gf0umnz,k8vzf3,1607402249.0,The_299_Bin,r/technews,"At some point, a loading bar was observed with an onlooker complaining this was taking FOREVER.",0,k8vzf3,[]
1,gf199dr,k8vzf3,1607413690.0,plsHelpmemes,r/technews,"Before anyone gets up in arms about ""ermahgerd my bank passwords"", keep in mind that most of the computational feats (especially large number factoring) done by quantum computing are mostly stunts without practical applications to cryptography. These look impressive but are mostly mathematical clickbait. [This stack overflow post describes it well.](https://crypto.stackexchange.com/questions/59795/largest-integer-factored-by-shors-algorithm) For all practical matters, the largest number ever factored by a quantum computer using Shor's algorithm is still only 35, and that was a year ago.

When I took a Quantum Computing class in University, I remember my professor specifically shits hard on D-Wave, as they peddle their achievements in number of cubits (something like 2000+) in their quantum computer. In reality, their cubits are ""low quality"" and basically useless. Most serious research efforts into Quantum by IBM/Google/Government use 100 cubits on the very high end. For reference, there is a [study done](https://arxiv.org/abs/1905.09749v2) that estimates the need for ~20million cubits to beat 2048 bit RSA.",0,k8vzf3,[]
2,gf0sgju,k8vzf3,1607400933.0,redditisntreallyfe,r/technews,Literally making cracking passwords under 12 characters now achievable in minutes,0,k8vzf3,[]
3,gf0v8ww,k8vzf3,1607402638.0,Alextryingforgrate,r/technews,But can it run Crysis on full graphics.,0,k8vzf3,[]
4,gf1l1to,k8vzf3,1607426103.0,Dimbus2000,r/technews,Sounds like the computer did 4 minutes worth of computing in 4 minutes,0,k8vzf3,[]
5,gf0zq54,k8vzf3,1607405649.0,basanthverma,r/technews,Did it say 42?,0,k8vzf3,[]
6,gf0wrb4,k8vzf3,1607403609.0,Dumdammok,r/technews,Can it run minecraft?,0,k8vzf3,[]
7,gf1ksal,k8vzf3,1607425840.0,imyourcaptainnotmine,r/technews,"Quantum computing really is ridiculous with what it can seem to do. 
Just like a good sci fi, whack on the word “quantum” to the start of anything and it’s instantly amazing. Can we expect a PLayStation Quantum one day?",0,k8vzf3,[]
8,gf1m81l,k8vzf3,1607427269.0,Arthur_Morgan1899,r/technews,"But can it run crysis?
Edit: But can it run Cyberpunk?",0,k8vzf3,[]
9,gf1zrtl,k8vzf3,1607437544.0,mrpotatonutz,r/technews,In the year 2020 sky net became self aware,0,k8vzf3,[]
10,gf0z18p,k8vzf3,1607405160.0,jmcrises187,r/technews,That’s not even a lot of years.,0,k8vzf3,[]
11,gf0z9ds,k8vzf3,1607405317.0,Solochrinihilistian,r/technews,4 minutes!? is it using dial up or something,0,k8vzf3,[]
12,gf15nlm,k8vzf3,1607410415.0,thiefofsheep,r/technews,Can this crack bitcoin 24-word phrases?,0,k8vzf3,[]
13,gf15vun,k8vzf3,1607410612.0,thiefofsheep,r/technews,BITCOIN?,0,k8vzf3,[]
14,gf191yw,k8vzf3,1607413493.0,paper_bull,r/technews,The answer was 42.,0,k8vzf3,[]
15,gf1bboi,k8vzf3,1607415729.0,G-mooooo,r/technews,Let’s mine some bitcoins fellas,0,k8vzf3,[]
16,gf1fz86,k8vzf3,1607420642.0,steveschoenberg,r/technews,So much for Moore’s Law.,0,k8vzf3,[]
17,gf1gevk,k8vzf3,1607421118.0,okisCyrus,r/technews,but can it run crysis?,0,k8vzf3,[]
18,gf1gjxe,k8vzf3,1607421263.0,indecisiveassassin,r/technews,You mean I have to wait #four# minutes for this.. ugh eF mY lIFe,0,k8vzf3,[]
19,gf1i7l3,k8vzf3,1607423092.0,BrondellSwashbuckle,r/technews,Uh oh. Imma need a stronger password.,0,k8vzf3,[]
20,gf1madi,k8vzf3,1607427333.0,weedanny1,r/technews,Why don’t they use it to cure covid or cancer?,0,k8vzf3,[]
21,gf1nvz1,k8vzf3,1607428863.0,penguinswithfedoras,r/technews,Plus it has that sweet razer rgb aesthetic.,0,k8vzf3,[]
22,gf1ousc,k8vzf3,1607429761.0,ElbowTight,r/technews,So all the Bitcoin has been mined..... can we have GPU’s back to normal now,0,k8vzf3,[]
23,gf1qn6o,k8vzf3,1607431298.0,strangerzero,r/technews,"There goes all online privacy, governments will buy a lot of these.",0,k8vzf3,[]
24,gf1wthw,k8vzf3,1607435750.0,KripC2160,r/technews,Wondering how long it will take before a new revolutionary computer comes out which can do the same which quantum computer takes 2.6 billion years to achieve,0,k8vzf3,[]
25,gf1xnxq,k8vzf3,1607436279.0,arcticlynx_ak,r/technews,How about we put a quantum computer to work color rising and improving all the historical images throughout history? As well as video. That’d be cool.,0,k8vzf3,[]
26,gf44c0f,k8vzf3,1607473423.0,YoSemiteThisSemite,r/technews,"So I’m that case...which religion is the superior religion...I have a few minutes, I’ll wait!
hehehe...",0,k8vzf3,[]
27,gf105ay,k8vzf3,1607405955.0,loriba1timore,r/technews,Can someone tell me if this is bad for Bitcoin?,0,k8vzf3,[]
28,gf0sghh,k8vzf3,1607400932.0,robertbreadford,r/technews,Nice,0,k8vzf3,[]
29,gf0y90p,k8vzf3,1607404620.0,Derrickmb,r/technews,So passwords are pointless lol,0,k8vzf3,[]
30,gf0w04s,k8vzf3,1607403113.0,GUMBYtheOG,r/technews,Where is this arbitrary “computation” measurement coming from. I’m guessing a fast contemporary computer is talking about an i7 processor or a gpu-based mining computer?,0,k8vzf3,[]
31,gf0vnxh,k8vzf3,1607402899.0,Id_Love_A_BabyCham,r/technews,Reckon they printed it out with a dot matrix?,0,k8vzf3,[]
32,gf0zji8,k8vzf3,1607405517.0,SuperSuchti_Official,r/technews,But can it run Crysis?,0,k8vzf3,[]
33,gf0zsg9,k8vzf3,1607405694.0,ZCallious,r/technews,I wanna use this to code hell world in Java I bet it’ll be super fast and super overkill!,0,k8vzf3,[]
34,gf109rm,k8vzf3,1607406045.0,myboomstik,r/technews,So when does this lead to them taking over humans?,0,k8vzf3,[]
35,gf11d9r,k8vzf3,1607406872.0,bagofnutella,r/technews,Anyone have success viewing paper? It has bad link on article,0,k8vzf3,[]
36,gf11u10,k8vzf3,1607407232.0,LogicIsMagic,r/technews,"Usually, they test a problem that can be solved in exponential time whereas validating the solution can be done in polynomial time

Google P vs NP for more info

So what about problems that are exponential for quantic computer ? They exists ... NP^2",0,k8vzf3,[]
37,gf12niu,k8vzf3,1607407880.0,Madmen3000,r/technews,But can it run Minecraft?,0,k8vzf3,[]
38,gf12xv3,k8vzf3,1607408114.0,muffinTrees,r/technews,What’s the point. What does this even do or mean,0,k8vzf3,[]
39,gf133sp,k8vzf3,1607408248.0,TheSimpsonsAreYellow,r/technews,Anyone else getting SkyNet vibes?,0,k8vzf3,[]
40,gf13am2,k8vzf3,1607408405.0,curtisnielsenii,r/technews,"We can’t access the forth dimension but our computers can.

*Siri flips you the bird and disappears out of existence*",0,k8vzf3,[]
41,gf13nw5,k8vzf3,1607408711.0,Luk3yboy99,r/technews,"Damn, this thing can brute-force my password in about 30 minutes. Time to make it longer (If the banks will let me have a 15+ character password)",0,k8vzf3,[]
42,gf14zs0,k8vzf3,1607409840.0,my40srock,r/technews,You could probably download all of pornhub in just a few hours,0,k8vzf3,[]
43,gf1520s,k8vzf3,1607409894.0,GlockAF,r/technews,We will know that quantum computing REALLY works when all bitcoin mined starts going to the same wallet,0,k8vzf3,[]
44,gf15x9z,k8vzf3,1607410647.0,idgafyouallsuck,r/technews,"What does that even mean though? Like 2.6 billion years of just running different equations like ‘2+2=4, 3+3=6, Mum+Dad=Why am I even here??’",0,k8vzf3,[]
45,gf16iwd,k8vzf3,1607411175.0,CritzD,r/technews,But can it run doom?,0,k8vzf3,[]
46,gf16o59,k8vzf3,1607411306.0,yanonce,r/technews,This is gonna KILL bitcoin,0,k8vzf3,[]
47,gf16xsy,k8vzf3,1607411552.0,Superc0ld,r/technews,How many Bitcoins is that?,0,k8vzf3,[]
48,gf17m8j,k8vzf3,1607412181.0,polothedawg,r/technews,So my uuid is no longer unique ? Sigh,0,k8vzf3,[]
49,gf184ry,k8vzf3,1607412651.0,Angel720_D,r/technews,So do you think it will know how many licks it will take to get to the center of tootsie pop,0,k8vzf3,[]
50,gf18j8n,k8vzf3,1607413019.0,jaesolo,r/technews,I feel way smarter thanks to this!,0,k8vzf3,[]
51,gf18nxz,k8vzf3,1607413141.0,Voodizzy_,r/technews,Still couldn’t run a cracked version of AoE 2 on a Mac without overheating,0,k8vzf3,[]
52,gf19gt7,k8vzf3,1607413887.0,superfaceplant47,r/technews,Where can I get one,0,k8vzf3,[]
53,gf19j94,k8vzf3,1607413951.0,pdgenoa,r/technews,Is there a way to compare its performance to our best supercomputer?,0,k8vzf3,[]
54,gf1ag1l,k8vzf3,1607414845.0,Covfefeisforclosers_,r/technews,"DEVS
DEUS",0,k8vzf3,[]
55,gf1cdar,k8vzf3,1607416796.0,Ok_Negotiation4950,r/technews,It’s all fake,0,k8vzf3,[]
56,gf1fd82,k8vzf3,1607419985.0,Extension_Canary3717,r/technews,Can it run crysis?,0,k8vzf3,[]
57,gf1g5t0,k8vzf3,1607420840.0,Kavethought,r/technews,*4 minutes later:* **Half-Life 3 confirmed**,0,k8vzf3,[]
58,gf1k6k6,k8vzf3,1607425211.0,dhishoomdhishoom,r/technews,and they again dreaming of replacing humans,0,k8vzf3,[]
59,gf1lnhw,k8vzf3,1607426705.0,goofgoon,r/technews,Those numbers probably will help things be a little more efficient.,0,k8vzf3,[]
60,gf1mpd2,k8vzf3,1607427743.0,readytobinformed247,r/technews,That quite a lot considering we don’t even know that many years in our history.,0,k8vzf3,[]
61,gf1n062,k8vzf3,1607428028.0,InkSymptoms,r/technews,So those password judge things that said that it would take a computer a million years to figure out my password has just been made into liars now huh? So like what? It would take one of these devices a few seconds to figure out my bank account information?,0,k8vzf3,[]
62,gf1ndwb,k8vzf3,1607428390.0,thorpay83,r/technews,I believe it’s using the Apple M2 chip,0,k8vzf3,[]
63,gf1ry0l,k8vzf3,1607432340.0,the__itis,r/technews,Another case of designing a problem for a solution.,0,k8vzf3,[]
64,gf1sjg9,k8vzf3,1607432797.0,tjuggins,r/technews,Devs,0,k8vzf3,[]
65,gf1sscf,k8vzf3,1607432984.0,TotesMessenger,r/technews,"I'm a bot, *bleep*, *bloop*. Someone has linked to this thread from another place on reddit:

- [/r/bitcoin] [Quantum device performs 2.6 billion years of computation in 4 minutes. What does this mean for the future of Crypto?](https://www.reddit.com/r/Bitcoin/comments/k93uki/quantum_device_performs_26_billion_years_of/)

&nbsp;*^(If you follow any of the above links, please respect the rules of reddit and don't vote in the other threads.) ^\([Info](/r/TotesMessenger) ^/ ^[Contact](/message/compose?to=/r/TotesMessenger))*",0,k8vzf3,[]
66,gf1t5pz,k8vzf3,1607433261.0,Nice_Try_Mod,r/technews,Aka it can load two copies of GTAV with mods at the same rate as a ps4,0,k8vzf3,[]
67,gf1tug2,k8vzf3,1607433759.0,WitchyCatLady3,r/technews,My brain hurts 🥴,0,k8vzf3,[]
68,gf1vq9b,k8vzf3,1607435043.0,SnooRevelations545,r/technews,Sounds evil,0,k8vzf3,[]
69,gf1xj7p,k8vzf3,1607436196.0,arcticlynx_ak,r/technews,How long till we get smart phone versions?,0,k8vzf3,[]
70,gf1xkxt,k8vzf3,1607436226.0,CriminalMacabre,r/technews,Now we can run crappy algorithms!,0,k8vzf3,[]
71,gf1zbjf,k8vzf3,1607437278.0,A10110101Z,r/technews,Are you sure it didn’t do 4 minutes worth?,0,k8vzf3,[]
72,gf1zx6r,k8vzf3,1607437630.0,yosup01,r/technews,What does this mean as far as affecting daily life?,0,k8vzf3,[]
73,gf21ip0,k8vzf3,1607438543.0,RealRolandDeschain19,r/technews,Can it run Crysis tho?,0,k8vzf3,[]
74,gf21naj,k8vzf3,1607438614.0,tallerThanYouAre,r/technews,42.,0,k8vzf3,[]
75,gf22e4l,k8vzf3,1607439023.0,vcdonkey,r/technews,The number is 42.,0,k8vzf3,[]
76,gf232nh,k8vzf3,1607439390.0,Prairy_fire,r/technews,Sure wish you didn’t buy the new ARM MacBook Air MacBooks and waited,0,k8vzf3,[]
77,gf234i0,k8vzf3,1607439417.0,momentum77,r/technews,"Yes, but can it mine crypto?",0,k8vzf3,[]
78,gf2377p,k8vzf3,1607439457.0,Aviyan,r/technews,Use this to crack master keys for ransomware.,0,k8vzf3,[]
79,gf239ra,k8vzf3,1607439495.0,elquecazahechado,r/technews,My laptop takes longer than that to turn on.,0,k8vzf3,[]
80,gf23gbr,k8vzf3,1607439593.0,murderboxsocial,r/technews,Bye bye encryption,0,k8vzf3,[]
81,gf23i05,k8vzf3,1607439617.0,the_Dorkness,r/technews,DEVS,0,k8vzf3,[]
82,gf23vm8,k8vzf3,1607439818.0,Chakodog,r/technews,42,0,k8vzf3,[]
83,gf25fl2,k8vzf3,1607440629.0,Pupusas4Ever,r/technews, Dumb question. Can it be use to mine bitcoins faster?,0,k8vzf3,[]
84,gf25lzy,k8vzf3,1607440721.0,rollo_slicer,r/technews,Anyone got this guy’s etsy,0,k8vzf3,[]
85,gf26tnf,k8vzf3,1607441329.0,DiligentGamer,r/technews,Crazy,0,k8vzf3,[]
86,gf27mf4,k8vzf3,1607441724.0,raffikeklikian,r/technews,How much computation could a computer compute if a computing computer could compute?,0,k8vzf3,[]
87,gf28o9c,k8vzf3,1607442243.0,cmonkey96,r/technews,What,0,k8vzf3,[]
88,gf28uhg,k8vzf3,1607442329.0,mad_titanz,r/technews,Can it help us design a space ship so we can find the nearest hospitable planet?,0,k8vzf3,[]
89,gf297x2,k8vzf3,1607442511.0,teamsum,r/technews,So should I buy a PS5 or a Quantum device? What do you guys think?,0,k8vzf3,[]
90,gf29q4b,k8vzf3,1607442756.0,mrector09,r/technews,:: makes computer noise in head ::,0,k8vzf3,[]
91,gf2bml7,k8vzf3,1607443675.0,Ba-dump-chink,r/technews,"In a few years, this will be the capability of the smartphone you carry in your hand (or some bio implant).",0,k8vzf3,[]
92,gf2e4dq,k8vzf3,1607444858.0,jdotlangill,r/technews,damn AMD is making some crazy silicone there,0,k8vzf3,[]
93,gf2ek4e,k8vzf3,1607445064.0,LordNedNoodle,r/technews,We all know the answer will be 42,0,k8vzf3,[]
94,gf2fca3,k8vzf3,1607445435.0,Euphoricas,r/technews,If this isn’t my next gaming pc I don’t want it,0,k8vzf3,[]
95,gf2iukj,k8vzf3,1607447073.0,johnesherman,r/technews,So do you need a fast typewriter for data entry and where’s the output hard copy printout print? 🤔,0,k8vzf3,[]
96,gf2iyyo,k8vzf3,1607447129.0,iwellyess,r/technews,WillI 2-step authentication still be good?,0,k8vzf3,[]
97,gf2jwb3,k8vzf3,1607447564.0,mc904,r/technews,Does it run protools?,0,k8vzf3,[]
98,gf2kdrw,k8vzf3,1607447789.0,G8kpr,r/technews,"So it should be able to handle cyberpunk 2077, is what you are saying.",0,k8vzf3,[]
99,gf2mdw7,k8vzf3,1607448708.0,RegularSound9200,r/technews,I’ve heard quantum computation described as using alternate universes to do multiple calculations. Is this true?  I only have a layman’s grasp of quantum computers.,0,k8vzf3,[]
100,gf2mpwg,k8vzf3,1607448863.0,VanguardBronco,r/technews,The technological singularity is upon us!,0,k8vzf3,[]
101,gf2nnyq,k8vzf3,1607449297.0,Organiksupercomputer,r/technews,I knew you’d say that as well,0,k8vzf3,[]
102,gf2o5w9,k8vzf3,1607449528.0,cptnpocket,r/technews,Quick mafs.,0,k8vzf3,[]
103,gf2oxj2,k8vzf3,1607449883.0,diegoesfuego99,r/technews,but can it run crysis,0,k8vzf3,[]
104,gf2p4fx,k8vzf3,1607449969.0,shafdaddy,r/technews,Why not 3?,0,k8vzf3,[]
105,gf2r86l,k8vzf3,1607450931.0,tetragrammaton19,r/technews,"Shit, now we're getting quantum computing down pact? This shit needs to be regulated now. What an amazing time to be alive.",0,k8vzf3,[]
106,gf2rbh9,k8vzf3,1607450973.0,BarsoomianAmbassador,r/technews,Passwords are now even more obsolete.,0,k8vzf3,[]
107,gf2s5pd,k8vzf3,1607451355.0,mcpat21,r/technews,Who has 2.6 billion years worth of computation yo solve when modern RAM performs 8 million tasks a second??,0,k8vzf3,[]
108,gf2sbt4,k8vzf3,1607451432.0,PocketRocketTrumpet,r/technews,"Sigh...I guess I’ll be the one who asks..

but can it run crysis?",0,k8vzf3,[]
109,gf2sijf,k8vzf3,1607451516.0,bmoral91,r/technews,Mrs.Trunchbull(Principal of Matildas School): ...so can a calculator!,0,k8vzf3,[]
110,gf2sqkp,k8vzf3,1607451617.0,SkyVINS,r/technews,".. i just wish they didn't call them ""quantum"" ...",0,k8vzf3,[]
111,gf2tq82,k8vzf3,1607452067.0,rumbollen,r/technews,"2.6 billlion years of computation.... on an 8mhz 80286 professor!!! Jokes you you, betches!",0,k8vzf3,[]
112,gf2uo6d,k8vzf3,1607452493.0,mmmericanMorph,r/technews,Does this affect encryption?,0,k8vzf3,[]
113,gf2v48r,k8vzf3,1607452693.0,AdamSkywalker129,r/technews,What if this computer tried to figure out the end of pi?,0,k8vzf3,[]
114,gf2vfik,k8vzf3,1607452833.0,lencastre,r/technews,"Yes, but will it blend?",0,k8vzf3,[]
115,gf2vvtx,k8vzf3,1607453037.0,HeyYes7776,r/technews,"Yeah, but can it make a perfect margarita?",0,k8vzf3,[]
116,gf2wstn,k8vzf3,1607453449.0,Fusjoedahh,r/technews,We are computing with light now,0,k8vzf3,[]
117,gf2y31w,k8vzf3,1607454022.0,dirtybacon77,r/technews,... still only gets 30FPS on Microsoft Flight Simulator,0,k8vzf3,[]
118,gf30q0b,k8vzf3,1607455218.0,WordsinaWhisper,r/technews,"ok, this is great. can it do my homework for math for me? 😅",0,k8vzf3,[]
119,gf3236l,k8vzf3,1607455837.0,ThinMan87,r/technews,Can we use it to help me with my job search please?,0,k8vzf3,[]
120,gf34cet,k8vzf3,1607456878.0,Scarlet109,r/technews,Nice,0,k8vzf3,[]
121,gf355yk,k8vzf3,1607457266.0,Troglodyte09,r/technews,"Can it run cyberpunk at 4k ultra, 60 FPS?",0,k8vzf3,[]
122,gf3791b,k8vzf3,1607458274.0,campbrs,r/technews,42,0,k8vzf3,[]
123,gf38hda,k8vzf3,1607458841.0,DomDeeKong,r/technews,What will be the impact on bitcoin?,0,k8vzf3,[]
124,gf39r0o,k8vzf3,1607459430.0,ShihPoosRule,r/technews,According to China who has a history of lying about pretty much everything.,0,k8vzf3,[]
125,gf3a6ut,k8vzf3,1607459633.0,marclande,r/technews,Can someone confirm if this is research being done by Honeywell?,0,k8vzf3,[]
126,gf3bapf,k8vzf3,1607460153.0,centrivical,r/technews,Quick maths,0,k8vzf3,[]
127,gf3bzvy,k8vzf3,1607460477.0,Greatmerp255,r/technews,That’s pretty cool,0,k8vzf3,[]
128,gf3ddze,k8vzf3,1607461124.0,hellowbucko,r/technews,"Question, how long does it take to load GTA Online?",0,k8vzf3,[]
129,gf3e1ge,k8vzf3,1607461429.0,jyrrr,r/technews,Make it compute pi,0,k8vzf3,[]
130,gf3lgdh,k8vzf3,1607464884.0,Cheating-Apple,r/technews,I bet this badboy can run crysis 3 at 60fps,0,k8vzf3,[]
131,gf3lq5n,k8vzf3,1607465013.0,Dr-Carnitine,r/technews,can i mine with it tho?,0,k8vzf3,[]
132,gf3mgyp,k8vzf3,1607465369.0,ThonyGreen,r/technews,Bet it cant run Crysis.,0,k8vzf3,[]
133,gf3n48l,k8vzf3,1607465689.0,IconoclasmicJooj,r/technews,What did it answer ?,0,k8vzf3,[]
134,gf3n85v,k8vzf3,1607465745.0,Andreas1120,r/technews,"They mentioned that the computer wasn't doing ""general computing"" but something more specialized.  What was the calculation? Does it have real world value?",0,k8vzf3,[]
135,gf3ng51,k8vzf3,1607465853.0,Kristaafis,r/technews,"This is easy to do and you don’t even need a quantum computer, just use gems to boost the computing time",0,k8vzf3,[]
136,gf3p4p3,k8vzf3,1607466687.0,5572Life,r/technews,42,0,k8vzf3,[]
137,gf3s9dx,k8vzf3,1607468276.0,clearbrian,r/technews,result.....42,0,k8vzf3,[]
138,gf3thpv,k8vzf3,1607468886.0,quesofamilia,r/technews,So the device did 4 minutes of computation?  This title is blowing my mind.,0,k8vzf3,[]
139,gf3uhd9,k8vzf3,1607469382.0,tomthedevguy,r/technews,So yeah everybody is saying this is practically useless right now but... isn’t the writing on the wall? Isn’t it going to be doing practical things in the foreseeable future?,0,k8vzf3,[]
140,gf3v6pj,k8vzf3,1607469680.0,dognotephilly,r/technews,Skynet decided our fate in a nanosecond...,0,k8vzf3,[]
141,gf41st8,k8vzf3,1607472396.0,stepsst00l,r/technews,42,0,k8vzf3,[]
142,gf41xlo,k8vzf3,1607472450.0,30tpirks,r/technews,But does it blend?,0,k8vzf3,[]
143,gf42hy2,k8vzf3,1607472684.0,magnaat,r/technews,Can it tell me how to get a PS5?,0,k8vzf3,[]
144,gf43495,k8vzf3,1607472931.0,dog5and,r/technews,I have absolutely no idea what is going on,0,k8vzf3,[]
145,gf438ew,k8vzf3,1607472977.0,LittleBobbyG614,r/technews,I bet if this science wasn’t way over my head it would seem less scary. 😐,0,k8vzf3,[]
146,gf48bj6,k8vzf3,1607475068.0,Greenlonkbeen,r/technews,This does put a smile on my face,0,k8vzf3,[]
147,gf493vl,k8vzf3,1607475444.0,Montag_451,r/technews,‘42’,0,k8vzf3,[]
148,gf4b956,k8vzf3,1607476546.0,WhileNotLurking,r/technews,*resets all passwords*. That should last me another 4 minutes...,0,k8vzf3,[]
149,gf4h9h7,k8vzf3,1607479562.0,LoganPaulSneezed,r/technews,This is very unspecific lol,0,k8vzf3,[]
150,gf4i16p,k8vzf3,1607479948.0,Glad_Inspection_1140,r/technews,So what did it figure out? If it took that long to do the calculations how long will it take for humans to read/understand it?,0,k8vzf3,[]
151,gf4pwtb,k8vzf3,1607484041.0,Gundam_Greg,r/technews,"But, can it see why kids love the taste of Cinnamon Toast Crunch!?",0,k8vzf3,[]
152,gf4si1t,k8vzf3,1607485499.0,Svyatoy_Medved,r/technews,Well clearly that’s now four minutes worth of computations,0,k8vzf3,[]
153,gf5r1so,k8vzf3,1607514759.0,chompster123,r/technews,Can i play cyberpunk on it?,0,k8vzf3,[]
154,gf6ka8j,k8vzf3,1607532139.0,MKInc,r/technews,"Wondering if the number is so high because for the last couple of billion years we have no proof of any computations, therefore even doing one computation counts as 2 billion years worth right there.",0,k8vzf3,[]
155,gkc68vn,k8vzf3,1611397141.0,premer777,r/technews,Unfortunately it takes 2.6 billion years to prove that its calculations are accurate/correct,0,k8vzf3,[]
156,gf0zuzu,k8vzf3,1607405747.0,Electricvincent,r/technews,Isn’t that technically 4 min of computing if they did it in 4 minutes,0,k8vzf3,[]
157,gf1y3op,k8vzf3,1607436553.0,dr_cold_90,r/technews,I feel like these articles are pretty misleading- the “calculation” being performed isn’t very extendible. I could write a program that would take years to figure out EXACTLY where a pencil will fall when I drop it; that doesn’t mean I’ve built a super computer when I drop the pencil and see where it lands.,0,k8vzf3,[]
158,gf2w5lb,k8vzf3,1607453158.0,Greenpoint_Blank,r/technews,"I mean that is cool and all, but can it run Crysis?",0,k8vzf3,[]
159,ik79nbi,wnqygj,1660441216.0,Tacoma_blues,r/technews,Linus Tech Tips doesn't count,0,wnqygj,[]
160,ik6yrky,wnqygj,1660435944.0,Rotlam,r/technews,"This makes sense. If it needs cold to operate properly, they have an advantage",0,wnqygj,[]
161,ik7d2r8,wnqygj,1660442867.0,Turbulent_Two2,r/technews,Will I be able to buy more VBucks through this computer?,0,wnqygj,[]
162,ik7hw49,wnqygj,1660445273.0,1Originalmind,r/technews,What would i ever do with a pc of that caliber?,0,wnqygj,[]
163,ik7dtmb,wnqygj,1660443225.0,CeeMX,r/technews,"Quantum computers is such a buzzterm, they already exist and you can probably buy them, if you have enough money. Even AWS already has a service for quantum computing.

But unless we get a shitton of more qubits stable, it won’t be useful for real world applications.",0,wnqygj,[]
164,ik790ap,wnqygj,1660440914.0,GingasaurusWrex,r/technews,Just need some encryption standards to finalize…,0,wnqygj,[]
165,ik7itk6,wnqygj,1660445755.0,Frater_Ankara,r/technews,"In 2013 I worked on the floor above DWave when they were working on their quantum computer.  I had a weird moment when I realized, based on their layout and our layout, one of the world’s most powerful computers was ten feet below my butt.",0,wnqygj,[]
166,ik7eks1,wnqygj,1660443600.0,redisprecious,r/technews,"Quantum porn, here we come.",0,wnqygj,[]
167,ik71hhk,wnqygj,1660437261.0,Aggravating_Permit98,r/technews,But can it run Squad at higher than 45 fps?,0,wnqygj,[]
168,ik79m9b,wnqygj,1660441203.0,Seeker_Of_Knowledge-,r/technews,I know it is a long way. But I will be happy enough if big companies can operate them for servers and cloud-gaming,0,wnqygj,[]
169,ik7cscs,wnqygj,1660442736.0,SirLooseButWhole,r/technews,Can I put a 3080 ti on it?,0,wnqygj,[]
170,ik6z649,wnqygj,1660436143.0,morbo26,r/technews,"Am I alone in thinking that ‘Quantum computers’ are not possible given our current knowledge of physics and when they are released, it will be ‘quantum’ in the same way that 3D TVs were 3D?",0,wnqygj,[]
171,ik7ntaa,wnqygj,1660448479.0,PigglesWiggle_,r/technews,I will give you Two Dollars and 15 cents!  The same amount Tank Girl and her friend were given to spy on Johnny Prophet and the Rippers!,0,wnqygj,[]
172,ik87vgf,wnqygj,1660462042.0,PaddleMonkey,r/technews,"Corporations are going to adopt it first, using it for data and market analysis. Then the tech will trickle down to consumers as the tech becomes more affordable.",0,wnqygj,[]
173,ik8s4db,wnqygj,1660478196.0,1leggeddog,r/technews,"isn't that a big problem though?

I thought that I read something along the lines of ""if quantum computers reach the public, any kind of encryption protocol is going to be essentially defunct""...",0,wnqygj,[]
174,ik8sz9l,wnqygj,1660478754.0,batman305555,r/technews,"You can already them. They are mostly at universities. While Canada has a lot of good engineers, it isn’t at the forefront of quantum by a long shot.",0,wnqygj,[]
175,ik8xgkc,wnqygj,1660481448.0,beleidigtewurst,r/technews,"Oh boy, buzzwords hit again.

Where are we with ""bitchain revolution"", surely, gazillion of companies are using them nowadays? Or aren't they? Doh...


Quantum computer is a type of an ""analog computer"". I.e.

1) There is a distinct physical process
2) There is a distinct heavy computation of interest that directly resembles the physical process in question
3) Instead of doing #2, we let #1 happen and check out results

This kind of thing existed years ago. What is new today is the specific physical processes that are being harnessed are from the quantum world.

That is it.


Note that:

1) It is not a generic computing device and it will never become one
2) Speed up in ""calculations"" is inherently tied to physical process being described by the same equations one is trying to solve
3) And a bummer is that the calculation result might or might not be correct. Probability of it being correct might be increased by adding more steps.",0,wnqygj,[]
176,ik965b3,wnqygj,1660485958.0,Crabcakes5_,r/technews,"I would hope more companies adopt quantum encryption standards sooner than later. Any asymmetrically encrypted data using traditional algorithms can hypothetically be stored today and later decrypted using QCs, so upgrading faster makes the compromised data more stale. QCs becoming viable sooner also increases this risk.",0,wnqygj,[]
